<!ELEMENT Letter (contact+,salutation,paragraph,closing,signature)>
<!ELEMENT contact (name,address,city,pin,state,flag)>
<!ATTLIST contact type  CDATA #FIXED "sender" >
<!ELEMENT sender  (#PCDATA)>
<!ELEMENT name (#PCDATA)>
<!ELEMENT address (#PCDATA)>
<!ELEMENT city (#PCDATA)>
<!ELEMENT pin (#PCDATA)>
<!ELEMENT state (#PCDATA)>
<!ELEMENT flag EMPTY>
<!ATTLIST flag Gender (Male|Female) "Male">
<!ELEMENT salutation (#PCDATA)>
<!ELEMENT paragraph (#PCDATA)>
<!ELEMENT closing (#PCDATA)>
<!ELEMENT signature (#PCDATA)>